{
  "approximations": {
    "attention": "softmax-max-shift",
    "gelu": "tanh"
  },
  "error_thresholds": {
    "max_abs_error": 1.9073486328125e-06,
    "weight_max_abs_error": 1.9073486328125e-06
  },
  "plan_id": "gpt2-small-d7-v1-dyadic-plan",
  "ring": "Z_2_64",
  "scales": {
    "layer_0.attn.k.bias": 18,
    "layer_0.attn.k.weight": 18,
    "layer_0.attn.proj.bias": 18,
    "layer_0.attn.proj.weight": 18,
    "layer_0.attn.q.bias": 18,
    "layer_0.attn.q.weight": 18,
    "layer_0.attn.v.bias": 18,
    "layer_0.attn.v.weight": 18,
    "layer_0.ln_1.bias": 18,
    "layer_0.ln_1.weight": 18,
    "layer_0.ln_2.bias": 18,
    "layer_0.ln_2.weight": 18,
    "layer_0.mlp.fc.bias": 18,
    "layer_0.mlp.fc.weight": 18,
    "layer_0.mlp.proj.bias": 18,
    "layer_0.mlp.proj.weight": 18,
    "layer_1.attn.k.bias": 18,
    "layer_1.attn.k.weight": 18,
    "layer_1.attn.proj.bias": 18,
    "layer_1.attn.proj.weight": 18,
    "layer_1.attn.q.bias": 18,
    "layer_1.attn.q.weight": 18,
    "layer_1.attn.v.bias": 18,
    "layer_1.attn.v.weight": 18,
    "layer_1.ln_1.bias": 18,
    "layer_1.ln_1.weight": 18,
    "layer_1.ln_2.bias": 18,
    "layer_1.ln_2.weight": 18,
    "layer_1.mlp.fc.bias": 18,
    "layer_1.mlp.fc.weight": 18,
    "layer_1.mlp.proj.bias": 18,
    "layer_1.mlp.proj.weight": 18,
    "layer_10.attn.k.bias": 18,
    "layer_10.attn.k.weight": 18,
    "layer_10.attn.proj.bias": 18,
    "layer_10.attn.proj.weight": 18,
    "layer_10.attn.q.bias": 18,
    "layer_10.attn.q.weight": 18,
    "layer_10.attn.v.bias": 18,
    "layer_10.attn.v.weight": 18,
    "layer_10.ln_1.bias": 18,
    "layer_10.ln_1.weight": 18,
    "layer_10.ln_2.bias": 18,
    "layer_10.ln_2.weight": 18,
    "layer_10.mlp.fc.bias": 18,
    "layer_10.mlp.fc.weight": 18,
    "layer_10.mlp.proj.bias": 18,
    "layer_10.mlp.proj.weight": 18,
    "layer_11.attn.k.bias": 18,
    "layer_11.attn.k.weight": 18,
    "layer_11.attn.proj.bias": 18,
    "layer_11.attn.proj.weight": 18,
    "layer_11.attn.q.bias": 18,
    "layer_11.attn.q.weight": 18,
    "layer_11.attn.v.bias": 18,
    "layer_11.attn.v.weight": 18,
    "layer_11.ln_1.bias": 18,
    "layer_11.ln_1.weight": 18,
    "layer_11.ln_2.bias": 18,
    "layer_11.ln_2.weight": 18,
    "layer_11.mlp.fc.bias": 18,
    "layer_11.mlp.fc.weight": 18,
    "layer_11.mlp.proj.bias": 18,
    "layer_11.mlp.proj.weight": 18,
    "layer_2.attn.k.bias": 18,
    "layer_2.attn.k.weight": 18,
    "layer_2.attn.proj.bias": 18,
    "layer_2.attn.proj.weight": 18,
    "layer_2.attn.q.bias": 18,
    "layer_2.attn.q.weight": 18,
    "layer_2.attn.v.bias": 18,
    "layer_2.attn.v.weight": 18,
    "layer_2.ln_1.bias": 18,
    "layer_2.ln_1.weight": 18,
    "layer_2.ln_2.bias": 18,
    "layer_2.ln_2.weight": 18,
    "layer_2.mlp.fc.bias": 18,
    "layer_2.mlp.fc.weight": 18,
    "layer_2.mlp.proj.bias": 18,
    "layer_2.mlp.proj.weight": 18,
    "layer_3.attn.k.bias": 18,
    "layer_3.attn.k.weight": 18,
    "layer_3.attn.proj.bias": 18,
    "layer_3.attn.proj.weight": 18,
    "layer_3.attn.q.bias": 18,
    "layer_3.attn.q.weight": 18,
    "layer_3.attn.v.bias": 18,
    "layer_3.attn.v.weight": 18,
    "layer_3.ln_1.bias": 18,
    "layer_3.ln_1.weight": 18,
    "layer_3.ln_2.bias": 18,
    "layer_3.ln_2.weight": 18,
    "layer_3.mlp.fc.bias": 18,
    "layer_3.mlp.fc.weight": 18,
    "layer_3.mlp.proj.bias": 18,
    "layer_3.mlp.proj.weight": 18,
    "layer_4.attn.k.bias": 18,
    "layer_4.attn.k.weight": 18,
    "layer_4.attn.proj.bias": 18,
    "layer_4.attn.proj.weight": 18,
    "layer_4.attn.q.bias": 18,
    "layer_4.attn.q.weight": 18,
    "layer_4.attn.v.bias": 18,
    "layer_4.attn.v.weight": 18,
    "layer_4.ln_1.bias": 18,
    "layer_4.ln_1.weight": 18,
    "layer_4.ln_2.bias": 18,
    "layer_4.ln_2.weight": 18,
    "layer_4.mlp.fc.bias": 18,
    "layer_4.mlp.fc.weight": 18,
    "layer_4.mlp.proj.bias": 18,
    "layer_4.mlp.proj.weight": 18,
    "layer_5.attn.k.bias": 18,
    "layer_5.attn.k.weight": 18,
    "layer_5.attn.proj.bias": 18,
    "layer_5.attn.proj.weight": 18,
    "layer_5.attn.q.bias": 18,
    "layer_5.attn.q.weight": 18,
    "layer_5.attn.v.bias": 18,
    "layer_5.attn.v.weight": 18,
    "layer_5.ln_1.bias": 18,
    "layer_5.ln_1.weight": 18,
    "layer_5.ln_2.bias": 18,
    "layer_5.ln_2.weight": 18,
    "layer_5.mlp.fc.bias": 18,
    "layer_5.mlp.fc.weight": 18,
    "layer_5.mlp.proj.bias": 18,
    "layer_5.mlp.proj.weight": 18,
    "layer_6.attn.k.bias": 18,
    "layer_6.attn.k.weight": 18,
    "layer_6.attn.proj.bias": 18,
    "layer_6.attn.proj.weight": 18,
    "layer_6.attn.q.bias": 18,
    "layer_6.attn.q.weight": 18,
    "layer_6.attn.v.bias": 18,
    "layer_6.attn.v.weight": 18,
    "layer_6.ln_1.bias": 18,
    "layer_6.ln_1.weight": 18,
    "layer_6.ln_2.bias": 18,
    "layer_6.ln_2.weight": 18,
    "layer_6.mlp.fc.bias": 18,
    "layer_6.mlp.fc.weight": 18,
    "layer_6.mlp.proj.bias": 18,
    "layer_6.mlp.proj.weight": 18,
    "layer_7.attn.k.bias": 18,
    "layer_7.attn.k.weight": 18,
    "layer_7.attn.proj.bias": 18,
    "layer_7.attn.proj.weight": 18,
    "layer_7.attn.q.bias": 18,
    "layer_7.attn.q.weight": 18,
    "layer_7.attn.v.bias": 18,
    "layer_7.attn.v.weight": 18,
    "layer_7.ln_1.bias": 18,
    "layer_7.ln_1.weight": 18,
    "layer_7.ln_2.bias": 18,
    "layer_7.ln_2.weight": 18,
    "layer_7.mlp.fc.bias": 18,
    "layer_7.mlp.fc.weight": 18,
    "layer_7.mlp.proj.bias": 18,
    "layer_7.mlp.proj.weight": 18,
    "layer_8.attn.k.bias": 18,
    "layer_8.attn.k.weight": 18,
    "layer_8.attn.proj.bias": 18,
    "layer_8.attn.proj.weight": 18,
    "layer_8.attn.q.bias": 18,
    "layer_8.attn.q.weight": 18,
    "layer_8.attn.v.bias": 18,
    "layer_8.attn.v.weight": 18,
    "layer_8.ln_1.bias": 18,
    "layer_8.ln_1.weight": 18,
    "layer_8.ln_2.bias": 18,
    "layer_8.ln_2.weight": 18,
    "layer_8.mlp.fc.bias": 18,
    "layer_8.mlp.fc.weight": 18,
    "layer_8.mlp.proj.bias": 18,
    "layer_8.mlp.proj.weight": 18,
    "layer_9.attn.k.bias": 18,
    "layer_9.attn.k.weight": 18,
    "layer_9.attn.proj.bias": 18,
    "layer_9.attn.proj.weight": 18,
    "layer_9.attn.q.bias": 18,
    "layer_9.attn.q.weight": 18,
    "layer_9.attn.v.bias": 18,
    "layer_9.attn.v.weight": 18,
    "layer_9.ln_1.bias": 18,
    "layer_9.ln_1.weight": 18,
    "layer_9.ln_2.bias": 18,
    "layer_9.ln_2.weight": 18,
    "layer_9.mlp.fc.bias": 18,
    "layer_9.mlp.fc.weight": 18,
    "layer_9.mlp.proj.bias": 18,
    "layer_9.mlp.proj.weight": 18,
    "lm_head.bias": 8,
    "lm_head.weight": 18,
    "ln_f.bias": 18,
    "ln_f.weight": 18,
    "position_embedding.weight": 18,
    "token_embedding.weight": 18
  },
  "tensor_layout": "row-major"
}
